{"schemaVersion":"1.0.0","id":"sharedHost","name":"sharedHost","release":{"id":"sharedHost:local","buildName":"sharedHost","buildVersion":"local"},"metaData":{"name":"sharedHost","type":"app","buildInfo":{"buildVersion":"local","buildName":"sharedHost","releaseId":"sharedHost:local"},"remoteEntry":{"name":"assets/remoteEntry-D406gCEz.js","path":"","type":"module","contentHash":"67ea1e6bd1ff0669cf5642b7a5fc6bf8881340ccd18d192740d54e39587129c1","integrity":"sha384-MDlMQwkrExfecu/DDpYVYKLwarDRRS+ZUG1P9UeyY+jgk/dZKIUBiKa4vHT4wQvQ"},"ssrRemoteEntry":{"name":"remoteEntry-[hash]","path":"","type":"module"},"types":{"path":"","name":"","api":""},"globalName":"sharedHost","pluginVersion":"0.0.3","publicPath":"/"},"shared":[{"id":"sharedHost:@mf-e2e/shared-value","name":"@mf-e2e/shared-value","version":"1.0.0","singleton":true,"requiredVersion":"*","allowNodeModulesSuffixMatch":false,"strictSingleton":false,"assets":{"js":{"async":[],"sync":["assets/shared-value-CBLDJVfk.js"]},"css":{"async":[],"sync":[]}}}],"remotes":[],"exposes":[]}