{"schemaVersion":"1.0.0","id":"sharedRemote","name":"sharedRemote","release":{"id":"sharedRemote:local","buildName":"sharedRemote","buildVersion":"local"},"metaData":{"name":"sharedRemote","type":"app","buildInfo":{"buildVersion":"local","buildName":"sharedRemote","releaseId":"sharedRemote:local"},"remoteEntry":{"name":"remoteEntry.js","path":"","type":"module","contentHash":"da14bb42d4bcab722c50a1da63b2bcd0e0433f35ff9d7f332a7badda7d56c8c7","integrity":"sha384-oKGVvLBzRapruXRZmtUfk/2PZEW4jgP/XTiVyiMvCLPBaG7Pejp/MfxftsbT2GbY"},"ssrRemoteEntry":{"name":"remoteEntry.ssr.js","path":"","type":"module","contentHash":"261b7718fa6ac1f90f8510a57e33f1548a3c778415ed9cc9152fb562a3b22d5a","integrity":"sha384-Agxzgj6mOLW/seixn3dOY95Hrbf2ExJHE1zeqAVwir5+SsBmBi0FaDZJFT9UxzuP"},"types":{"path":"","name":"","api":""},"globalName":"sharedRemote","pluginVersion":"0.0.3","publicPath":"/"},"shared":[{"id":"sharedRemote:@mf-e2e/shared-value","name":"@mf-e2e/shared-value","version":"2.0.0","singleton":true,"requiredVersion":"*","allowNodeModulesSuffixMatch":false,"strictSingleton":false,"assets":{"js":{"async":[],"sync":["assets/shared-value-CJrTKsBK.js"]},"css":{"async":[],"sync":[]}}}],"remotes":[],"exposes":[{"id":"sharedRemote:Widget","name":"Widget","css":{"mode":"head"},"assets":{"js":{"async":[],"sync":["assets/Widget-Cc0PZJi9.js"]},"css":{"async":[],"sync":[]}},"path":"./Widget"}]}