{
  "schemaVersion": "1.0.0",
  "id": "catalogRemote",
  "name": "catalogRemote",
  "release": {
    "id": "catalogRemote:abc1234",
    "buildName": "main",
    "buildVersion": "abc1234"
  },
  "metaData": {
    "name": "catalogRemote",
    "type": "app",
    "buildInfo": {
      "buildName": "main",
      "buildVersion": "abc1234",
      "releaseId": "catalogRemote:abc1234"
    },
    "remoteEntry": {
      "name": "remoteEntry.js",
      "path": "",
      "type": "module",
      "integrity": "sha384-manifestRemoteEntryIntegrity",
      "contentHash": "1111111111111111111111111111111111111111111111111111111111111111"
    },
    "ssrRemoteEntry": {
      "name": "remoteEntry.ssr.js",
      "path": "server",
      "type": "module",
      "integrity": "sha384-manifestSsrRemoteEntryIntegrity",
      "contentHash": "2222222222222222222222222222222222222222222222222222222222222222"
    },
    "types": {
      "path": "",
      "name": "@mf-types.zip",
      "api": "@mf-types.d.ts"
    },
    "globalName": "catalogRemote",
    "pluginVersion": "0.0.3",
    "publicPath": "https://cdn.example.com/catalog/"
  },
  "shared": [
    {
      "id": "catalogRemote:react",
      "name": "react",
      "version": "19.2.4",
      "singleton": true,
      "requiredVersion": "^19.2.4",
      "assets": {
        "js": {
          "async": [],
          "sync": ["assets/react.js"]
        },
        "css": {
          "async": [],
          "sync": []
        }
      }
    }
  ],
  "remotes": [],
  "exposes": [
    {
      "id": "catalogRemote:Button",
      "name": "Button",
      "css": {
        "mode": "head"
      },
      "assets": {
        "js": {
          "async": [],
          "sync": ["assets/Button.js"]
        },
        "css": {
          "async": [],
          "sync": ["assets/Button.css"]
        }
      },
      "path": "./Button"
    }
  ]
}
