{"schemaVersion":"1.0.0","id":"sharedRemote","name":"sharedRemote","release":{"id":"sharedRemote:local","buildName":"sharedRemote","buildVersion":"local"},"metaData":{"name":"sharedRemote","type":"app","buildInfo":{"buildVersion":"local","buildName":"sharedRemote","releaseId":"sharedRemote:local"},"remoteEntry":{"name":"remoteEntry.js","path":"","type":"module","contentHash":"e7a9c0d977983dcec70694a6c6d795086fe3ce77927f8484e921e8318d103cb3","integrity":"sha384-RyXgZ+QnwMmF4A6MCcemIDrTyP5+vXGNNFRWtGsyyHqnDMeljv+3i6E65mKR70/w"},"ssrRemoteEntry":{"name":"remoteEntry.ssr.js","path":"","type":"module","contentHash":"f5495b03941afc4ecdbff5077fc73841aa70e3447a9ce8d2c2c28f76bc92c06e","integrity":"sha384-3vm1m+CphQfeCxoQnblI2i8SzlqynV0nuRuHF/l8e2+nXkofHcoexE10WlfYLeRb"},"types":{"path":"","name":"","api":""},"globalName":"sharedRemote","pluginVersion":"0.0.3","publicPath":"/"},"shared":[{"id":"sharedRemote:@mf-e2e/shared-value","name":"@mf-e2e/shared-value","version":"2.0.0","singleton":true,"requiredVersion":"*","allowNodeModulesSuffixMatch":false,"strictSingleton":false,"assets":{"js":{"async":[],"sync":["assets/shared-value-CJrTKsBK.js"]},"css":{"async":[],"sync":[]}}}],"remotes":[],"exposes":[{"id":"sharedRemote:Widget","name":"Widget","css":{"mode":"head"},"assets":{"js":{"async":[],"sync":["assets/Widget-Cc0PZJi9.js"]},"css":{"async":[],"sync":[]}},"path":"./Widget"}]}